{
  "id": "F7A1…",
  "title": "Auth refactor plan",
  "createdAt": "2026-08-18T18:22:04Z",
  "origin": {
    "kind": "cowork",
    "sessionId": "8f3c1d…",
    "threadTitle": "Q3 platform planning",
    "returnPath": { "type": "poke", "triggerId": "trig_…" }
  },
  "sourceFormat": "markdown",
  "pageCount": 4
}
